<!DOCTYPE frameset SYSTEM "frameset.dtd">
<frameset>
<predicate lemma="hound">
<note>
  Frames file for 'hound' based on survey of sentences in the WSJ
  corpus. 
</note>

<roleset id="hound.01" name="to harass or nag" vncls="-">
<roles>
  <role descr="harasser" n="0"/>
  <role descr="entity hounded" n="1"/>
</roles>

<example name="transitive">
<inflection aspect="ns" form="full" person="ns" tense="past" voice="active"/>
<text>
 In testimony recorded [*] in the grand jury report , court employees said [0] the judge , now 59 years old , harassed his secretaries , made imperial demands on his staff and hounded anyone who [*T*-157] crossed him .
</text>
	<arg n="0">the judge , now 59 years old ,</arg>
	<rel>hounded</rel>
	<arg n="1">anyone who [*T*-157] crossed him</arg>
</example>


</roleset>
</predicate>


</frameset>
