<!DOCTYPE frameset SYSTEM "frameset.dtd">
<frameset>
<predicate lemma="pounce">
<note>
  Frames file for 'pounce' based on survey of sentences in the WSJ
  corpus. 
</note>

<roleset id="pounce.01" name="to attack suddenly" vncls="-">
<roles>
  <role descr="attacker, agent" n="0"/>
  <role descr="thing pounced on" n="1"/>
</roles>

<example name="transitive">
<inflection aspect="ns" form="infinitive" person="ns" tense="ns" voice="active"/>
<text>
 Here was [*T*-1] the state security appartus poised [*] to pounce on any words or acts of provocation , let alone revolution .
</text>
	<arg n="0">[*] -&gt;  the state security appartus</arg>
	<rel>pounce</rel>
	<arg f="on" n="1">any words or acts of provocation , let alone revolution</arg>
</example>


</roleset>
</predicate>


</frameset>
